{
	"type":"object",
	"$schema": "http://json-schema.org/draft-03/schema",
	"id": "#/diabetes/cbg.json",
  "title": "continuous blood glucose (CBG)",
  "name": "cbg",
  "description": "Readings from a continuously monitoring device",
	"properties":{
		"deviceTime": {
			"type":"string",
			"id": "http://jsonschema.net/cbg/deviceTime",
			"required":true
		},
		"id": {
			"type":"string",
			"id": "http://jsonschema.net/cbg/id",
			"required":false
		},
		"type": {
			"type":"string",
			"id": "http://jsonschema.net/type/cbg",
			"required":true
		},
		"value": {
			"type":"number",
			"id": "http://jsonschema.net/cbg/value",
			"required":true
		}
	}
}
