[
  {
      "deviceTime": "2014-02-04T04:46:08",
      "type": "smbg",
      "id": "eef2f145-5f63-4b80-b19b-94b3921cb3c1",
      "value": 149
  },
  {
      "deviceTime": "2014-02-04T04:46:08",
      "type": "smbg",
      "id": "eef2f145-5f63-4b80-b19b-94b3921cb3c1",
      "value": 149
  },
  {
      "deviceTime": "2014-02-04T04:46:08",
      "type": "smbg",
      "id": "eef2f145-5f63-4b80-b19b-94b3921cb3c1",
      "value": 149
  }
]
