[
  {
      "deviceTime": "2014-02-03T18:06:06",
      "type": "cbg",
      "id": "ba72e270-2d48-48c0-8f63-0ac2914fb759",
      "value": 77
  },
  {
      "deviceTime": "2014-02-03T18:06:06",
      "type": "cbg",
      "id": "ba72e270-2d48-48c0-8f63-0ac2914fb759",
      "value": 77
  },
  {
      "deviceTime": "2014-02-03T18:06:06",
      "type": "cbg",
      "id": "ba72e270-2d48-48c0-8f63-0ac2914fb759",
      "value": 77
  }
]
